{
 "schema": "am-actuator-spec/1",
 "id": "AM-H-F",
 "vendor": "Artificial Motion",
 "model": "H-F",
 "status": "design target; SIMULATED, not built. Product preview: fully designed and simulated. Specifications are design targets for evaluation units shipping in Q1 2027.",
 "data_revision": "Data revision 2026-10-12",
 "sources": [
  {
   "url": "https://artificialmotion.com",
   "accessed": "2026-10-07",
   "note": "per-unit download H-F_params.json, copied in am_sdk/data/H-F/"
  }
 ],
 "notes": "Continuous rating is the typical unit; end-of-life continuous 47.02 N m. Published continuous clamp 62 N m. Peak: 2 s event from a warm start.",
 "assumptions": [
  {
   "field": "ratings.peak_recovery_s_per_s",
   "value": 0.1,
   "basis": "AM SDK simulator model value (am_sdk/backends/sim.py), not a published rating"
  },
  {
   "field": "friction.coulomb_nm",
   "value": 1.72,
   "basis": "published unpowered backdrive torque used as Coulomb friction"
  },
  {
   "field": "friction.viscous_nm_s_per_rad",
   "value": 0.0,
   "basis": "viscous damping not specified in the published data; 0"
  },
  {
   "field": "thermal.nodes.tau_s",
   "value": 210.0,
   "basis": "no published time constant for this unit; conservative family value (shortest published family value), as in the SDK simulator"
  },
  {
   "field": "thermal.nodes.c_j_per_k",
   "value": 902.8199999999999,
   "basis": "lumped heat capacity = 600 J/(kg K) x actuator mass (aluminium/steel/copper/magnet mix); an order-of-magnitude assumption; scales watts only"
  },
  {
   "field": "thermal.rated_winding_c",
   "value": 105.0,
   "basis": "AM SDK simulator model value (am_sdk/backends/sim.py), not a published rating"
  },
  {
   "field": "thermal.derate_c",
   "value": 105.0,
   "basis": "AM SDK simulator model value (am_sdk/backends/sim.py), not a published rating"
  },
  {
   "field": "thermal.trip_c",
   "value": 130.0,
   "basis": "AM SDK simulator model value (am_sdk/backends/sim.py), not a published rating"
  },
  {
   "field": "thermal.trip_hysteresis_k",
   "value": 5.0,
   "basis": "AM SDK simulator model value (am_sdk/backends/sim.py), not a published rating"
  }
 ],
 "mechanical": {
  "ratio": 22.5,
  "mass_kg": 1.5047,
  "reflected_inertia_kgm2": 0.04635336274897429,
  "gear_efficiency": 0.9194,
  "backdrive_nm": 1.72
 },
 "ratings": {
  "peak_nm": 115,
  "peak_duration_s": 2.0,
  "peak_recovery_s_per_s": 0.1,
  "continuous_nm": 54.73,
  "continuous_speed_rad_s": 6.283185307179586,
  "nominal_bus_v": 48,
  "no_load_speed_rad_s": {
   "48": 14.618877814704502,
   "36": 10.84896663039675
  },
  "conditions": {
   "stated": true,
   "ambient_c": 25.0,
   "cooling": "bolted_structure",
   "mount_k_per_w": 0.2083,
   "text": "25 C ambient, still air, bolted to the robot structure (declared mount 0.2083 K/W), 48 V"
  }
 },
 "torque_speed": [
  {
   "bus_v": 48.0,
   "kind": "peak",
   "speed_unit": "rpm",
   "points": [
    [
     0,
     115
    ],
    [
     10,
     115
    ],
    [
     20,
     115
    ],
    [
     30,
     115
    ],
    [
     40,
     115
    ],
    [
     50,
     115
    ],
    [
     60,
     115
    ],
    [
     70,
     115
    ],
    [
     80,
     108.7
    ],
    [
     90,
     89.8
    ],
    [
     100,
     71.2
    ],
    [
     110,
     51.9
    ],
    [
     120,
     31.72
    ],
    [
     130,
     21.35
    ],
    [
     139.6,
     0
    ]
   ]
  },
  {
   "bus_v": 48.0,
   "kind": "continuous",
   "speed_unit": "rpm",
   "points": [
    [
     0,
     56.61
    ],
    [
     10,
     59.54
    ],
    [
     20,
     58.73
    ],
    [
     30,
     57.82
    ],
    [
     40,
     56.85
    ],
    [
     50,
     55.83
    ],
    [
     60,
     54.73
    ],
    [
     70,
     53.55
    ],
    [
     80,
     52.34
    ],
    [
     90,
     51.05
    ],
    [
     100,
     49.74
    ],
    [
     110,
     45.61
    ],
    [
     120,
     31.72
    ],
    [
     130,
     21.35
    ],
    [
     139.6,
     0
    ]
   ]
  },
  {
   "bus_v": 36.0,
   "kind": "peak",
   "speed_unit": "rpm",
   "points": [
    [
     0,
     115
    ],
    [
     10,
     115
    ],
    [
     20,
     115
    ],
    [
     30,
     115
    ],
    [
     40,
     115
    ],
    [
     45,
     115
    ],
    [
     50,
     115
    ],
    [
     60,
     97.7
    ],
    [
     70,
     74.3
    ],
    [
     75,
     62.65
    ],
    [
     80,
     51
    ],
    [
     90,
     25.2
    ],
    [
     103.6,
     0
    ]
   ]
  },
  {
   "bus_v": 36.0,
   "kind": "continuous",
   "speed_unit": "rpm",
   "points": [
    [
     0,
     56.61
    ],
    [
     10,
     59.54
    ],
    [
     30,
     57.82
    ],
    [
     45,
     56.34
    ],
    [
     60,
     54.7
    ],
    [
     75,
     52.06
    ],
    [
     90,
     19.74
    ],
    [
     103.6,
     0
    ]
   ]
  }
 ],
 "friction": {
  "coulomb_nm": 1.72,
  "viscous_nm_s_per_rad": 0.0,
  "stribeck": null
 },
 "electrical": {
  "kt_nm_per_a": 0.123224,
  "kt_basis": "AM motor design data, H-F (Kt at 60 C; nominal gear efficiency)",
  "phase_resistance_ohm": null,
  "current_limit_a": null
 },
 "thermal": {
  "model": "1node",
  "loss_calibration": "rating",
  "rated_winding_c": 105.0,
  "derate_c": 105.0,
  "trip_c": 130.0,
  "trip_hysteresis_k": 5.0,
  "derate_law": "sqrt",
  "copper_tempco_per_k": 0.00393,
  "nodes": {
   "tau_s": 210.0,
   "c_j_per_k": 902.8199999999999
  },
  "iron_loss": {
   "k1_w_per_rad_s": 0.0,
   "k2_w_s2_per_rad2": 0.0
  },
  "mechanical_losses_heat_actuator": true
 }
}
