{
 "schema": "am-actuator-spec/1",
 "id": "AM-S-D",
 "vendor": "Artificial Motion",
 "model": "S-D",
 "status": "design target; SIMULATED, not built. Product preview: fully designed and simulated. Specifications are design targets for evaluation units shipping in Q1 2027.",
 "data_revision": "Data revision 2026-10-12",
 "sources": [
  {
   "url": "https://artificialmotion.com",
   "accessed": "2026-10-07",
   "note": "per-unit download S-D_params.json, copied in am_sdk/data/S-D/"
  }
 ],
 "notes": "Continuous rating is the typical unit; end-of-life continuous 5.47 N m. Published continuous clamp 9.07 N m. Peak: 2 s event from a warm start.",
 "assumptions": [
  {
   "field": "ratings.peak_recovery_s_per_s",
   "value": 0.1,
   "basis": "AM SDK simulator model value (am_sdk/backends/sim.py), not a published rating. The one-node model is normalised so that 105 C is the winding temperature at the published continuous rating; the drive's own sensor thresholds (datasheet Protection Limits, e.g. derating onset 130 C and trip 150 C on M and H) use a different, physical scale"
  },
  {
   "field": "friction.coulomb_nm",
   "value": 0.36,
   "basis": "published unpowered backdrive torque used as Coulomb friction"
  },
  {
   "field": "friction.viscous_nm_s_per_rad",
   "value": 0.0,
   "basis": "viscous damping not specified in the published data; 0"
  },
  {
   "field": "thermal.nodes.tau_s",
   "value": 210.01602668279628,
   "basis": "published thermal time constant (dominant passive mode, rated mount)"
  },
  {
   "field": "thermal.nodes.c_j_per_k",
   "value": 280.68,
   "basis": "lumped heat capacity = 600 J/(kg K) x actuator mass (aluminium/steel/copper/magnet mix); an order-of-magnitude assumption; scales watts only"
  },
  {
   "field": "thermal.rated_winding_c",
   "value": 105.0,
   "basis": "AM SDK simulator model value (am_sdk/backends/sim.py), not a published rating. The one-node model is normalised so that 105 C is the winding temperature at the published continuous rating; the drive's own sensor thresholds (datasheet Protection Limits, e.g. derating onset 130 C and trip 150 C on M and H) use a different, physical scale"
  },
  {
   "field": "thermal.derate_c",
   "value": 105.0,
   "basis": "AM SDK simulator model value (am_sdk/backends/sim.py), not a published rating. The one-node model is normalised so that 105 C is the winding temperature at the published continuous rating; the drive's own sensor thresholds (datasheet Protection Limits, e.g. derating onset 130 C and trip 150 C on M and H) use a different, physical scale"
  },
  {
   "field": "thermal.trip_c",
   "value": 130.0,
   "basis": "AM SDK simulator model value (am_sdk/backends/sim.py), not a published rating. The one-node model is normalised so that 105 C is the winding temperature at the published continuous rating; the drive's own sensor thresholds (datasheet Protection Limits, e.g. derating onset 130 C and trip 150 C on M and H) use a different, physical scale"
  },
  {
   "field": "thermal.trip_hysteresis_k",
   "value": 5.0,
   "basis": "AM SDK simulator model value (am_sdk/backends/sim.py), not a published rating. The one-node model is normalised so that 105 C is the winding temperature at the published continuous rating; the drive's own sensor thresholds (datasheet Protection Limits, e.g. derating onset 130 C and trip 150 C on M and H) use a different, physical scale"
  }
 ],
 "mechanical": {
  "ratio": 9,
  "mass_kg": 0.4678,
  "reflected_inertia_kgm2": 0.000968,
  "gear_efficiency": 0.965,
  "backdrive_nm": 0.36
 },
 "ratings": {
  "peak_nm": 15,
  "peak_duration_s": 2.0,
  "peak_recovery_s_per_s": 0.1,
  "continuous_nm": 7.08,
  "continuous_speed_rad_s": 12.0,
  "nominal_bus_v": 48,
  "no_load_speed_rad_s": {
   "48": 42.74660403984512,
   "36": 31.77197370330477
  },
  "conditions": {
   "stated": true,
   "ambient_c": 25.0,
   "cooling": "bolted_structure",
   "mount_k_per_w": 0.732422,
   "text": "25 C ambient, still air, bolted to the robot structure (declared mount 0.732422 K/W), 48 V"
  }
 },
 "torque_speed": [
  {
   "bus_v": 48.0,
   "kind": "peak",
   "speed_unit": "rpm",
   "points": [
    [
     0,
     12
    ],
    [
     10,
     15
    ],
    [
     20,
     15
    ],
    [
     40,
     15
    ],
    [
     60,
     15
    ],
    [
     80,
     15
    ],
    [
     100,
     15
    ],
    [
     114.59,
     15
    ],
    [
     120,
     15
    ],
    [
     140,
     15
    ],
    [
     159.5253,
     15
    ],
    [
     160,
     14.9714
    ],
    [
     180,
     13.765
    ],
    [
     200,
     12.5586
    ],
    [
     220,
     11.3522
    ],
    [
     240,
     10.1458
    ],
    [
     260,
     8.9394
    ],
    [
     280,
     7.733
    ],
    [
     300,
     6.642
    ],
    [
     320,
     6.59
    ],
    [
     340,
     5.784
    ],
    [
     360,
     4.61
    ],
    [
     380,
     3.115
    ],
    [
     400,
     1.146
    ],
    [
     408.2,
     0.6761
    ]
   ]
  },
  {
   "bus_v": 48.0,
   "kind": "continuous",
   "speed_unit": "rpm",
   "points": [
    [
     0,
     6.696
    ],
    [
     20,
     7.263
    ],
    [
     40,
     7.233
    ],
    [
     60,
     7.195
    ],
    [
     80,
     7.154
    ],
    [
     100,
     7.111
    ],
    [
     114.59,
     7.079
    ],
    [
     120,
     7.068
    ],
    [
     140,
     7.023
    ],
    [
     160,
     6.979
    ],
    [
     180,
     6.933
    ],
    [
     200,
     6.886
    ],
    [
     220,
     6.839
    ],
    [
     240,
     6.791
    ],
    [
     260,
     6.742
    ],
    [
     280,
     6.692
    ],
    [
     300,
     6.642
    ],
    [
     320,
     6.59
    ],
    [
     340,
     5.784
    ],
    [
     360,
     4.61
    ],
    [
     380,
     3.115
    ],
    [
     400,
     1.146
    ],
    [
     408.2,
     0.6761
    ]
   ]
  },
  {
   "bus_v": 36.0,
   "kind": "peak",
   "speed_unit": "rpm",
   "points": [
    [
     0,
     12
    ],
    [
     10,
     15
    ],
    [
     20,
     15
    ],
    [
     40,
     15
    ],
    [
     60,
     15
    ],
    [
     66.5725,
     15
    ],
    [
     80,
     14.1495
    ],
    [
     100,
     12.8828
    ],
    [
     114.59,
     11.9587
    ],
    [
     120,
     11.6161
    ],
    [
     140,
     10.3493
    ],
    [
     160,
     9.0826
    ],
    [
     180,
     7.8158
    ],
    [
     200,
     6.917
    ],
    [
     220,
     6.869
    ],
    [
     240,
     5.891
    ],
    [
     260,
     4.559
    ],
    [
     280,
     2.828
    ],
    [
     300,
     0.535
    ],
    [
     303.4,
     0.4441
    ]
   ]
  },
  {
   "bus_v": 36.0,
   "kind": "continuous",
   "speed_unit": "rpm",
   "points": [
    [
     0,
     6.718
    ],
    [
     20,
     7.286
    ],
    [
     40,
     7.256
    ],
    [
     60,
     7.225
    ],
    [
     80,
     7.185
    ],
    [
     100,
     7.143
    ],
    [
     114.59,
     7.111
    ],
    [
     120,
     7.099
    ],
    [
     140,
     7.055
    ],
    [
     160,
     7.01
    ],
    [
     180,
     6.964
    ],
    [
     200,
     6.917
    ],
    [
     220,
     6.869
    ],
    [
     240,
     5.891
    ],
    [
     260,
     4.559
    ],
    [
     280,
     2.828
    ],
    [
     300,
     0.535
    ],
    [
     303.4,
     0.4441
    ]
   ]
  }
 ],
 "friction": {
  "coulomb_nm": 0.36,
  "viscous_nm_s_per_rad": 0.0,
  "stribeck": null
 },
 "electrical": {
  "kt_nm_per_a": 0.0924,
  "kt_basis": "AM motor design data, S-D (peak-referred Kt; nominal gear efficiency)",
  "phase_resistance_ohm": null,
  "current_limit_a": null
 },
 "thermal": {
  "model": "1node",
  "loss_calibration": "rating",
  "rated_winding_c": 105.0,
  "derate_c": 105.0,
  "trip_c": 130.0,
  "trip_hysteresis_k": 5.0,
  "derate_law": "sqrt",
  "copper_tempco_per_k": 0.00393,
  "nodes": {
   "tau_s": 210.01602668279628,
   "c_j_per_k": 280.68
  },
  "iron_loss": {
   "k1_w_per_rad_s": 0.0,
   "k2_w_s2_per_rad2": 0.0
  },
  "mechanical_losses_heat_actuator": true
 }
}
